PMID,Title,Authors,Citation,First Author,Journal/Book,Publication Year,Create Date,PMCID,NIHMS ID,DOI
"33472837","Predictors of disease severity in children presenting from the community with febrile illnesses: a systematic review of prognostic studies","Chandna A, Tan R, Carter M, Van Den Bruel A, Verbakel J, Koshiaris C, Salim N, Lubell Y, Turner P, Keitel K.","BMJ Glob Health. 2021 Jan;6(1):e003451. doi: 10.1136/bmjgh-2020-003451.","Chandna A","BMJ Glob Health","2021","2021/01/21","PMC7818824","","10.1136/bmjgh-2020-003451"
"30846489","Development and performance evaluation of the Medicines Optimisation Assessment Tool (MOAT): a prognostic model to target hospital pharmacists' input to prevent medication-related problems","Geeson C, Wei L, Franklin BD.","BMJ Qual Saf. 2019 Aug;28(8):645-656. doi: 10.1136/bmjqs-2018-008335. Epub 2019 Mar 7.","Geeson C","BMJ Qual Saf","2019","2019/03/09","PMC6716361","","10.1136/bmjqs-2018-008335"
"32373717","Reporting guideline checklists are not quality evaluation forms: they are guidance for writing","Logullo P, MacCarthy A, Kirtley S, Collins GS.","Health Sci Rep. 2020 May 3;3(2):e165. doi: 10.1002/hsr2.165. eCollection 2020 Jun.","Logullo P","Health Sci Rep","2020","2020/05/07","PMC7196677","","10.1002/hsr2.165"
"32376755","Construction of the secondary care administrative records frailty (SCARF) index and validation on older women with operable invasive breast cancer in England and Wales: a cohort study","Jauhari Y, Gannon MR, Dodwell D, Horgan K, Clements K, Medina J, Tsang C, Robinson T, Tang SS, Pettengell R, Cromwell DA.","BMJ Open. 2020 May 5;10(5):e035395. doi: 10.1136/bmjopen-2019-035395.","Jauhari Y","BMJ Open","2020","2020/05/08","PMC7223146","","10.1136/bmjopen-2019-035395"
"32907855","Risk stratification of patients admitted to hospital with covid-19 using the ISARIC WHO Clinical Characterisation Protocol: development and validation of the 4C Mortality Score","Knight SR, Ho A, Pius R, Buchan I, Carson G, Drake TM, Dunning J, Fairfield CJ, Gamble C, Green CA, Gupta R, Halpin S, Hardwick HE, Holden KA, Horby PW, Jackson C, Mclean KA, Merson L, Nguyen-Van-Tam JS, Norman L, Noursadeghi M, Olliaro PL, Pritchard MG, Russell CD, Shaw CA, Sheikh A, Solomon T, Sudlow C, Swann OV, Turtle LC, Openshaw PJ, Baillie JK, Semple MG, Docherty AB, Harrison EM; ISARIC4C investigators.","BMJ. 2020 Sep 9;370:m3339. doi: 10.1136/bmj.m3339.","Knight SR","BMJ","2020","2020/09/10","PMC7116472","EMS104583","10.1136/bmj.m3339"
"31093545","External validation, update and development of prediction models for pre-eclampsia using an Individual Participant Data (IPD) meta-analysis: the International Prediction of Pregnancy Complication Network (IPPIC pre-eclampsia) protocol","Allotey J, Snell KIE, Chan C, Hooper R, Dodds J, Rogozinska E, Khan KS, Poston L, Kenny L, Myers J, Thilaganathan B, Chappell L, Mol BW, Von Dadelszen P, Ahmed A, Green M, Poon L, Khalil A, Moons KGM, Riley RD, Thangaratinam S; IPPIC Collaborative Network.","Diagn Progn Res. 2017 Oct 3;1:16. doi: 10.1186/s41512-017-0016-z. eCollection 2017.","Allotey J","Diagn Progn Res","2017","2019/05/17","PMC6460674","","10.1186/s41512-017-0016-z"
"34670780","Risk of bias in studies on prediction models developed using supervised machine learning techniques: systematic review","Andaur Navarro CL, Damen JAA, Takada T, Nijman SWJ, Dhiman P, Ma J, Collins GS, Bajpai R, Riley RD, Moons KGM, Hooft L.","BMJ. 2021 Oct 20;375:n2281. doi: 10.1136/bmj.n2281.","Andaur Navarro CL","BMJ","2021","2021/10/21","PMC8527348","","10.1136/bmj.n2281"
"34805817","Performance of models to predict hepatocellular carcinoma risk among UK patients with cirrhosis and cured HCV infection","Innes H, Jepsen P, McDonald S, Dillon J, Hamill V, Yeung A, Benselin J, Went A, Fraser A, Bathgate A, Ansari MA, Barclay ST, Goldberg D, Hayes PC, Johnson P, Barnes E, Irving W, Hutchinson S, Guha IN.","JHEP Rep. 2021 Oct 7;3(6):100384. doi: 10.1016/j.jhepr.2021.100384. eCollection 2021 Dec.","Innes H","JHEP Rep","2021","2021/11/22","PMC8585647","","10.1016/j.jhepr.2021.100384"
"34432797","Regional performance variation in external validation of four prediction models for severity of COVID-19 at hospital admission: An observational multi-centre cohort study","Wickstrøm KE, Vitelli V, Carr E, Holten AR, Bendayan R, Reiner AH, Bean D, Searle T, Shek A, Kraljevic Z, Teo J, Dobson R, Tonby K, Köhn-Luque A, Amundsen EK.","PLoS One. 2021 Aug 25;16(8):e0255748. doi: 10.1371/journal.pone.0255748. eCollection 2021.","Wickstrøm KE","PLoS One","2021","2021/08/25","PMC8386866","","10.1371/journal.pone.0255748"
"39447145","Targeted Development and Validation of Clinical Prediction Models in Secondary Care Settings: Opportunities and Challenges for Electronic Health Record Data","van Maurik IS, Doodeman HJ, Veeger-Nuijens BW, Möhringer RPM, Sudiono DR, Jongbloed W, van Soelen E.","JMIR Med Inform. 2024 Oct 24;12:e57035. doi: 10.2196/57035.","van Maurik IS","JMIR Med Inform","2024","2024/10/24","PMC11615704","","10.2196/57035"
"40178039","Clinical Prediction Models for Contact X-Ray Brachytherapy in Managing Rectal Cancers: A Scoping Review","Haq MU, Pritchard DM, Myint AS, Javed MA, Duckworth CA, Than NW, Bonnett LJ, Hughes DM.","Cancer Med. 2025 Apr;14(7):e70697. doi: 10.1002/cam4.70697.","Haq MU","Cancer Med","2025","2025/04/03","PMC11966560","","10.1002/cam4.70697"
"40079336","Harnessing Electronic Health Records and Artificial Intelligence for Enhanced Cardiovascular Risk Prediction: A Comprehensive Review","Tsai ML, Chen KF, Chen PC.","J Am Heart Assoc. 2025 Mar 18;14(6):e036946. doi: 10.1161/JAHA.124.036946. Epub 2025 Mar 13.","Tsai ML","J Am Heart Assoc","2025","2025/03/13","PMC12132661","","10.1161/JAHA.124.036946"
"40469198","External validation of the Oncotype DX breast cancer recurrence score nomogram and development and validation of a novel machine learning-based model to predict postoperative overall survival and guide adjuvant chemotherapy in ER positive, Her-2 negative breast cancer patients: a retrospective cohort study","Wang D, Wang X, Yang X.","Front Oncol. 2025 May 21;15:1586262. doi: 10.3389/fonc.2025.1586262. eCollection 2025.","Wang D","Front Oncol","2025","2025/06/05","PMC12133539","","10.3389/fonc.2025.1586262"
"38214102","Development and validation of a nomogram for predicting immune-related pneumonitis after sintilimab treatment","Hong B, Chen R, Zheng C, Liu M, Yang J.","Cancer Med. 2024 Feb;13(3):e6708. doi: 10.1002/cam4.6708. Epub 2024 Jan 12.","Hong B","Cancer Med","2024","2024/01/12","PMC10905226","","10.1002/cam4.6708"
"39890609","Risk Stratification for Trial Enrichment Considering Loco-Regional Failure in Head and Neck Cancer: UICC8 Versus Purpose-Built Failure-Type Specific Risk Prediction Model","Håkansson K, Muse DH, Bäck A, Rasmussen JH, Lindegaard AM, Specht L, Friborg J, Cange HH, Vogelius IR.","Head Neck. 2025 Jul;47(7):1831-1838. doi: 10.1002/hed.28085. Epub 2025 Jan 31.","Håkansson K","Head Neck","2025","2025/01/31","PMC12146813","","10.1002/hed.28085"
"37477951","Diagnostic Test Accuracy of Deep Learning Prediction Models on COVID-19 Severity: Systematic Review and Meta-Analysis","Wang C, Liu S, Tang Y, Yang H, Liu J.","J Med Internet Res. 2023 Jul 21;25:e46340. doi: 10.2196/46340.","Wang C","J Med Internet Res","2023","2023/07/21","PMC10403760","","10.2196/46340"
"39969552","Reproducibility of methodological radiomics score (METRICS): an intra- and inter-rater reliability study endorsed by EuSoMII","Akinci D'Antonoli T, Cavallo AU, Kocak B, Borgheresi A, Ponsiglione A, Stanzione A, Koltsakis E, Doniselli FM, Vernuccio F, Ugga L, Triantafyllou M, Huisman M, Klontzas ME, Trotta R, Cannella R, Fanni SC, Cuocolo R.","Eur Radiol. 2025 Aug;35(8):4533-4545. doi: 10.1007/s00330-025-11443-1. Epub 2025 Feb 19.","Akinci D'Antonoli T","Eur Radiol","2025","2025/02/19","PMC12226626","","10.1007/s00330-025-11443-1"
"40638683","Improving meningitis surveillance and diagnosis with machine learning: Insights from São Paulo","Victor A, Medeiros Santos DA, Nery EK, Mori DP, de Carvalho Lucas PC, Cammarota D, Florez Montero GL, Barcellos Filho FN, Frugis Yu AL, Carvalhanas TRMP.","PLOS Digit Health. 2025 Jul 10;4(7):e0000925. doi: 10.1371/journal.pdig.0000925. eCollection 2025 Jul.","Victor A","PLOS Digit Health","2025","2025/07/10","PMC12244477","","10.1371/journal.pdig.0000925"
"39702639","MRI-based prediction of microvascular invasion/high tumor grade and adjuvant therapy benefit for solitary HCC ≤ 5 cm: a multicenter cohort study","Jiang H, Li B, Zheng T, Qin Y, Wu Y, Wu Z, Ronot M, Chernyak V, Fowler KJ, Bashir MR, Chen W, Wang YC, Ju S, Song B.","Eur Radiol. 2025 Jun;35(6):3223-3237. doi: 10.1007/s00330-024-11295-1. Epub 2024 Dec 19.","Jiang H","Eur Radiol","2025","2024/12/20","PMC12081510","","10.1007/s00330-024-11295-1"
"39521255","Phase 3 Validation of PAaM for Hepatocellular Carcinoma Risk Stratification in Cirrhosis","Fujiwara N, Lopez C, Marsh TL, Raman I, Marquez CA, Paul S, Mishra SK, Kubota N, Katz C, Kanzaki H, Gonzalez M, Quirk L, Deodhar S, Selvakumar P, Raj P, Parikh ND, Roberts LR, Schwartz ME, Nguyen MH, Befeler AS, Page-Lester S, Srivastava S, Feng Z, Reddy KR, Khaderi S, Asrani SK, Kanwal F, El-Serag HB, Marrero JA, Singal AG, Hoshida Y.","Gastroenterology. 2025 Mar;168(3):556-567.e7. doi: 10.1053/j.gastro.2024.10.035. Epub 2024 Nov 8.","Fujiwara N","Gastroenterology","2025","2024/11/09","PMC7617545","EMS204080","10.1053/j.gastro.2024.10.035"
"40669905","Machine learning model for postpancreaticoduodenectomy haemorrhage prediction: an international multicentre cohort study","Zhang Z, Zhao X, Shang M, Xu Q, Wang X, Zhang J, Wang C, Gu Z.","BMJ Open. 2025 Jul 16;15(7):e096147. doi: 10.1136/bmjopen-2024-096147.","Zhang Z","BMJ Open","2025","2025/07/16","PMC12278129","","10.1136/bmjopen-2024-096147"
"40414257","Microbial Markers for Diagnosis and Risk Assessment for Periodontal Diseases: A Systematic Literature Search and Narrative Synthesis","Bostanci N, Manoil D, Van Holm W, Belibasakis GN, Teughels W.","J Clin Periodontol. 2025 Aug;52 Suppl 29(Suppl 29):125-154. doi: 10.1111/jcpe.14183. Epub 2025 May 25.","Bostanci N","J Clin Periodontol","2025","2025/05/25","PMC12286651","","10.1111/jcpe.14183"
"35061509","Development and Validation of a Predictive Model of Severe Fatigue After Breast Cancer Diagnosis: Toward a Personalized Framework in Survivorship Care","Di Meglio A, Havas J, Soldato D, Presti D, Martin E, Pistilli B, Menvielle G, Dumas A, Charles C, Everhard S, Martin AL, Coutant C, Tarpin C, Vanlemmens L, Levy C, Rigal O, Delaloge S, Lin NU, Ganz PA, Partridge AH, André F, Michiels S, Vaz-Luis I.","J Clin Oncol. 2022 Apr 1;40(10):1111-1123. doi: 10.1200/JCO.21.01252. Epub 2022 Jan 21.","Di Meglio A","J Clin Oncol","2022","2022/01/21","PMC8966972","","10.1200/JCO.21.01252"
"40133723","Predicting hemorrhagic transformation in acute ischemic stroke: a systematic review, meta-analysis, and methodological quality assessment of CT/MRI-based deep learning and radiomics models","Salimi M, Vadipour P, Bahadori AR, Houshi S, Mirshamsi A, Fatemian H.","Emerg Radiol. 2025 Jun;32(3):409-433. doi: 10.1007/s10140-025-02336-3. Epub 2025 Mar 26.","Salimi M","Emerg Radiol","2025","2025/03/26","","","10.1007/s10140-025-02336-3"
"34025755","Predicting outcome in liver patients admitted to intensive care: A dual-centre non-specialist hospital external validation of the Liver injury and Failure evaluation score","de Sausmarez E, Crowest P, Fry S, Hodgson L.","J Intensive Care Soc. 2021 May;22(2):152-158. doi: 10.1177/1751143720924352. Epub 2020 May 8.","de Sausmarez E","J Intensive Care Soc","2021","2021/05/24","PMC8120575","","10.1177/1751143720924352"
"33643398","[Predictive validity of a functional classification method in older adultsValidação preditiva de método de classificação funcional em idosos]","García-Arango V, Osorio-Ciro J, Aguirre-Acevedo D, Vanegas-Vargas C, Clavijo-Usuga C, Gallo-Villegas J.","Rev Panam Salud Publica. 2021 Feb 26;45:e15. doi: 10.26633/RPSP.2021.15. eCollection 2021.","García-Arango V","Rev Panam Salud Publica","2021","2021/03/01","PMC7905750","","10.26633/RPSP.2021.15"
"38191489","Preoperative prediction of early recurrence in resectable pancreatic cancer integrating clinical, radiologic, and CT radiomics features","Lee JH, Shin J, Min JH, Jeong WK, Kim H, Choi SY, Lee J, Hong S, Kim K.","Cancer Imaging. 2024 Jan 8;24(1):6. doi: 10.1186/s40644-024-00653-3.","Lee JH","Cancer Imaging","2024","2024/01/08","PMC10775464","","10.1186/s40644-024-00653-3"
"36149932","Prediction models for the prediction of unplanned hospital admissions in community-dwelling older adults: A systematic review","Klunder JH, Panneman SL, Wallace E, de Vries R, Joling KJ, Maarsingh OR, van Hout HPJ.","PLoS One. 2022 Sep 23;17(9):e0275116. doi: 10.1371/journal.pone.0275116. eCollection 2022.","Klunder JH","PLoS One","2022","2022/09/23","PMC9506609","","10.1371/journal.pone.0275116"
"36380607","Construction and Validation of Early Warning Model of Lung Cancer Based on Machine Learning: A Retrospective Study","Ye S, Pan J, Ye Z, Cao Z, Cai X, Zheng H, Ye H.","Technol Cancer Res Treat. 2022 Jan-Dec;21:15330338221136724. doi: 10.1177/15330338221136724.","Ye S","Technol Cancer Res Treat","2022","2022/11/16","PMC9676307","","10.1177/15330338221136724"
"27738831","Methods for individualized assessment of absolute risk in case-control studies should be weighted carefully","Haaf KT, Steyerberg EW.","Eur J Epidemiol. 2016 Nov;31(11):1067-1068. doi: 10.1007/s10654-016-0206-y. Epub 2016 Oct 13.","Haaf KT","Eur J Epidemiol","2016","2016/10/15","PMC5206256","","10.1007/s10654-016-0206-y"
"33731210","External validation of an opioid misuse machine learning classifier in hospitalized adult patients","Afshar M, Sharma B, Bhalla S, Thompson HM, Dligach D, Boley RA, Kishen E, Simmons A, Perticone K, Karnik NS.","Addict Sci Clin Pract. 2021 Mar 17;16(1):19. doi: 10.1186/s13722-021-00229-7.","Afshar M","Addict Sci Clin Pract","2021","2021/03/18","PMC7967783","","10.1186/s13722-021-00229-7"
"37950235","Fear of movement was associated with sedentary behaviour 12 months after lumbar fusion surgery in patients with low back pain and degenerative disc disorder","Jakobsson M, Hagströmer M, Lotzke H, von Rosen P, Lundberg M.","BMC Musculoskelet Disord. 2023 Nov 10;24(1):874. doi: 10.1186/s12891-023-06980-z.","Jakobsson M","BMC Musculoskelet Disord","2023","2023/11/11","PMC10636920","","10.1186/s12891-023-06980-z"
"34102299","Forecasting Individual Patient Response to Radiation Therapy in Head and Neck Cancer With a Dynamic Carrying Capacity Model","Zahid MU, Mohsin N, Mohamed ASR, Caudell JJ, Harrison LB, Fuller CD, Moros EG, Enderling H.","Int J Radiat Oncol Biol Phys. 2021 Nov 1;111(3):693-704. doi: 10.1016/j.ijrobp.2021.05.132. Epub 2021 Jun 5.","Zahid MU","Int J Radiat Oncol Biol Phys","2021","2021/06/08","PMC8463501","NIHMS1730038","10.1016/j.ijrobp.2021.05.132"
"27456080","Predicting prolonged dose titration in patients starting warfarin","Finkelman BS, French B, Bershaw L, Brensinger CM, Streiff MB, Epstein AE, Kimmel SE.","Pharmacoepidemiol Drug Saf. 2016 Nov;25(11):1228-1235. doi: 10.1002/pds.4069. Epub 2016 Jul 26.","Finkelman BS","Pharmacoepidemiol Drug Saf","2016","2016/07/27","PMC5093054","NIHMS815396","10.1002/pds.4069"
"33857224","Can predicting COVID-19 mortality in a European cohort using only demographic and comorbidity data surpass age-based prediction: An externally validated study","Chatterjee A, Wu G, Primakov S, Oberije C, Woodruff H, Kubben P, Henry R, Aries MJH, Beudel M, Noordzij PG, Dormans T, Gritters van den Oever NC, van den Bergh JP, Wyers CE, Simsek S, Douma R, Reidinga AC, de Kruif MD, Guiot J, Frix AN, Louis R, Moutschen M, Lovinfosse P, Lambin P.","PLoS One. 2021 Apr 15;16(4):e0249920. doi: 10.1371/journal.pone.0249920. eCollection 2021.","Chatterjee A","PLoS One","2021","2021/04/15","PMC8049248","","10.1371/journal.pone.0249920"
"36229351","Estimating skills level in recreational skiing: Development and validation of a practical multidimensional instrument","Luppino FS, den Hollander-Gijsman ME, Dekker FW, Bartlema KA, van Diepen M.","Scand J Med Sci Sports. 2023 Jan;33(1):55-63. doi: 10.1111/sms.14245. Epub 2022 Oct 22.","Luppino FS","Scand J Med Sci Sports","2023","2022/10/13","PMC10091691","","10.1111/sms.14245"
"39384247","The LIVERAID (LIVER And Infectious Diseases)-ICU score predicts in-hospital mortality in liver cirrhosis patients with infections in the intensive care unit","Hoppmann H, Zeman F, Wittmann D, Stöckert P, Schlosser-Hupf S, Mehrl A, Pavel V, Müller M, Schmid S.","BMJ Open Gastroenterol. 2024 Oct 8;11(1):e001482. doi: 10.1136/bmjgast-2024-001482.","Hoppmann H","BMJ Open Gastroenterol","2024","2024/10/09","PMC11481117","","10.1136/bmjgast-2024-001482"
"36120359","Development and internal validation of simplified predictive scoring (ICU-SEPSA score) for mortality in patients with multidrug resistant infection","Sirichayanugul T, Srisawat C, Thummakomut C, Prawang A, Huynh NS, Saokaew S, Phisalprapa P, Kanchanasurakit S.","Front Pharmacol. 2022 Aug 26;13:938028. doi: 10.3389/fphar.2022.938028. eCollection 2022.","Sirichayanugul T","Front Pharmacol","2022","2022/09/19","PMC9472650","","10.3389/fphar.2022.938028"
"36291865","Radiomic and Volumetric Measurements as Clinical Trial Endpoints-A Comprehensive Review","Funingana IG, Piyatissa P, Reinius M, McCague C, Basu B, Sala E.","Cancers (Basel). 2022 Oct 17;14(20):5076. doi: 10.3390/cancers14205076.","Funingana IG","Cancers (Basel)","2022","2022/10/27","PMC9599928","","10.3390/cancers14205076"
"39394180","Development and assessment of algorithms for predicting brain amyloid positivity in a population without dementia","Le Scouarnec L, Bouteloup V, van der Veere PJ, van der Flier WM, Teunissen CE, Verberk IMW, Planche V, Chêne G, Dufouil C.","Alzheimers Res Ther. 2024 Oct 11;16(1):219. doi: 10.1186/s13195-024-01595-5.","Le Scouarnec L","Alzheimers Res Ther","2024","2024/10/11","PMC11468062","","10.1186/s13195-024-01595-5"
"33077558","Prognostic models for predicting in-hospital paediatric mortality in resource-limited countries: a systematic review","Ogero M, Sarguta RJ, Malla L, Aluvaala J, Agweyu A, English M, Onyango NO, Akech S.","BMJ Open. 2020 Oct 19;10(10):e035045. doi: 10.1136/bmjopen-2019-035045.","Ogero M","BMJ Open","2020","2020/10/20","PMC7574949","","10.1136/bmjopen-2019-035045"
"32796184","The Development and Validation of a Machine Learning Model to Predict Bacteremia and Fungemia in Hospitalized Patients Using Electronic Health Record Data","Bhavani SV, Lonjers Z, Carey KA, Afshar M, Gilbert ER, Shah NS, Huang ES, Churpek MM.","Crit Care Med. 2020 Nov;48(11):e1020-e1028. doi: 10.1097/CCM.0000000000004556.","Bhavani SV","Crit Care Med","2020","2020/08/16","PMC7554143","NIHMS1610673","10.1097/CCM.0000000000004556"
"38095747","Development and internal validation of a multivariable model for the prediction of the probability of 1-year readmission to the emergency department for acute alcohol intoxication","Palmese F, Bonavita ME, Pompili E, Reggidori N, Migliano MT, Di Stefano C, Grieco M, Colazzo S, Baldassarre M, Caraceni P, Foschi FG, Giostra F, Farina G, Del Toro R, Bedogni G, Domenicali M.","Intern Emerg Med. 2024 Apr;19(3):823-829. doi: 10.1007/s11739-023-03490-7. Epub 2023 Dec 14.","Palmese F","Intern Emerg Med","2024","2023/12/14","","","10.1007/s11739-023-03490-7"
"34007897","Development of a prognostic prediction model to estimate the risk of multiple chronic diseases: constructing a copula-based model using Canadian primary care electronic medical record data","Black JE, Kueper JK, Terry AL, Lizotte DJ.","Int J Popul Data Sci. 2021 Jan 19;6(1):1395. doi: 10.23889/ijpds.v5i1.1395.","Black JE","Int J Popul Data Sci","2021","2021/05/19","PMC8112224","","10.23889/ijpds.v5i1.1395"
"34070016","MRI-Based Radiomics Analysis for the Pretreatment Prediction of Pathologic Complete Tumor Response to Neoadjuvant Systemic Therapy in Breast Cancer Patients: A Multicenter Study","Granzier RWY, Ibrahim A, Primakov SP, Samiei S, van Nijnatten TJA, de Boer M, Heuts EM, Hulsmans FJ, Chatterjee A, Lambin P, Lobbes MBI, Woodruff HC, Smidt ML.","Cancers (Basel). 2021 May 18;13(10):2447. doi: 10.3390/cancers13102447.","Granzier RWY","Cancers (Basel)","2021","2021/06/02","PMC8157878","","10.3390/cancers13102447"
"33090707","Development of a model to predict vestibular schwannoma growth: An opportunity to introduce new wait and scan strategies","Hentschel MA, Hannink G, Steens SCA, Mulder JJS, Rovers MM, Kunst HPM.","Clin Otolaryngol. 2021 Jan;46(1):273-283. doi: 10.1111/coa.13661. Epub 2020 Nov 6.","Hentschel MA","Clin Otolaryngol","2021","2020/10/22","PMC7821120","","10.1111/coa.13661"
"26077062","Making advances in delirium research: coupling delirium outcomes research and data sharing","Salluh JI, Latronico N.","Intensive Care Med. 2015 Jul;41(7):1327-9. doi: 10.1007/s00134-015-3864-4. Epub 2015 Jun 3.","Salluh JI","Intensive Care Med","2015","2015/06/17","","","10.1007/s00134-015-3864-4"
"33899102","Assessment of the confidence interval in the multivariable normal tissue complication probability model for predicting radiation-induced liver disease in primary liver cancer","Prayongrat A, Srimaneekarn N, Sriswasdi S, Ito YM, Katoh N, Tamura M, Dekura Y, Toramatsu C, Khorprasert C, Amornwichet N, Alisanant P, Hirata Y, Hayter A, Shirato H, Shimizu S, Kobashi K.","J Radiat Res. 2021 May 12;62(3):483-493. doi: 10.1093/jrr/rrab011.","Prayongrat A","J Radiat Res","2021","2021/04/26","PMC8127660","","10.1093/jrr/rrab011"
"33033089","Predicting the chance on live birth per cycle at each step of the IVF journey: external validation and update of the van Loendersloot multivariable prognostic model","Devroe J, Peeraer K, Verbeke G, Spiessens C, Vriens J, Dancet E.","BMJ Open. 2020 Oct 8;10(10):e037289. doi: 10.1136/bmjopen-2020-037289.","Devroe J","BMJ Open","2020","2020/10/09","PMC7545639","","10.1136/bmjopen-2020-037289"
"36426170","Predictors of Postoperative Outcome in Emergency Laparotomy for Perforation Peritonitis; a Retrospective Cross-sectional Study","Rai A, Huda F, Kumar P, David LE, S C, Basu S, Singh S.","Arch Acad Emerg Med. 2022 Oct 31;10(1):e86. doi: 10.22037/aaem.v10i1.1827. eCollection 2022.","Rai A","Arch Acad Emerg Med","2022","2022/11/25","PMC9676704","","10.22037/aaem.v10i1.1827"
"36805926","Electronic health record-based prediction models for in-hospital adverse drug event diagnosis or prognosis: a systematic review","Yasrebi-de Kom IAR, Dongelmans DA, de Keizer NF, Jager KJ, Schut MC, Abu-Hanna A, Klopotowska JE.","J Am Med Inform Assoc. 2023 Apr 19;30(5):978-988. doi: 10.1093/jamia/ocad014.","Yasrebi-de Kom IAR","J Am Med Inform Assoc","2023","2023/02/22","PMC10114128","","10.1093/jamia/ocad014"
"35105622","Development of a clinical prediction model to inform clinical decision making for classification of patients with sciatica, based on their clinical characteristics, in the Greek health system: protocol for a prospective predictive exploratory study","Kontakiotis N, Rushton AB, Billis E, Papathanasiou G, Gioftsos G.","BMJ Open. 2022 Jan 31;12(1):e052119. doi: 10.1136/bmjopen-2021-052119.","Kontakiotis N","BMJ Open","2022","2022/02/02","PMC8804639","","10.1136/bmjopen-2021-052119"
"36809006","Toward Predicting 30-Day Readmission Among Oncology Patients: Identifying Timely and Actionable Risk Factors","Hwang S, Urbanowicz R, Lynch S, Vernon T, Bresz K, Giraldo C, Kennedy E, Leabhart M, Bleacher T, Ripchinski MR, Mowery DL, Oyer RA.","JCO Clin Cancer Inform. 2023 Feb;7:e2200097. doi: 10.1200/CCI.22.00097.","Hwang S","JCO Clin Cancer Inform","2023","2023/02/22","PMC10476733","","10.1200/CCI.22.00097"
"36857023","Predicting survival after radiosurgery in patients with lung cancer brain metastases using deep learning of radiomics and EGFR status","Liao CY, Lee CC, Yang HC, Chen CJ, Chung WY, Wu HM, Guo WY, Liu RS, Lu CF.","Phys Eng Sci Med. 2023 Jun;46(2):585-596. doi: 10.1007/s13246-023-01234-7. Epub 2023 Mar 1.","Liao CY","Phys Eng Sci Med","2023","2023/03/01","","","10.1007/s13246-023-01234-7"
"35513428","Gender differences in frailty transition and its prediction in community-dwelling old adults","Mielke N, Schneider A, Huscher D, Ebert N, Schaeffner E.","Sci Rep. 2022 May 5;12(1):7341. doi: 10.1038/s41598-022-11358-7.","Mielke N","Sci Rep","2022","2022/05/05","PMC9072330","","10.1038/s41598-022-11358-7"
"36512392","Model for Predicting In-Hospital Mortality of Physical Trauma Patients Using Artificial Intelligence Techniques: Nationwide Population-Based Study in Korea","Lee S, Kang WS, Seo S, Kim DW, Ko H, Kim J, Lee S, Lee J.","J Med Internet Res. 2022 Dec 13;24(12):e43757. doi: 10.2196/43757.","Lee S","J Med Internet Res","2022","2022/12/13","PMC9795391","","10.2196/43757"
"36756153","Non-enhanced magnetic resonance imaging-based radiomics model for the differentiation of pancreatic adenosquamous carcinoma from pancreatic ductal adenocarcinoma","Li Q, Li X, Liu W, Yu J, Chen Y, Zhu M, Li N, Liu F, Wang T, Fang X, Li J, Lu J, Shao C, Bian Y.","Front Oncol. 2023 Jan 23;13:1108545. doi: 10.3389/fonc.2023.1108545. eCollection 2023.","Li Q","Front Oncol","2023","2023/02/09","PMC9900003","","10.3389/fonc.2023.1108545"
"31651317","Three myths about risk thresholds for prediction models","Wynants L, van Smeden M, McLernon DJ, Timmerman D, Steyerberg EW, Van Calster B; Topic Group ‘Evaluating diagnostic tests and prediction models’ of the STRATOS initiative.","BMC Med. 2019 Oct 25;17(1):192. doi: 10.1186/s12916-019-1425-3.","Wynants L","BMC Med","2019","2019/10/26","PMC6814132","","10.1186/s12916-019-1425-3"
