PMID,Title,Authors,Citation,First Author,Journal/Book,Publication Year,Create Date,PMCID,NIHMS ID,DOI
"32383124","External validation of a prognostic model for intensive care unit mortality: a retrospective study using the Ontario Critical Care Information System","Priestap F, Kao R, Martin CM.","Can J Anaesth. 2020 Aug;67(8):981-991. doi: 10.1007/s12630-020-01686-5. Epub 2020 May 7.","Priestap F","Can J Anaesth","2020","2020/05/09","PMC7223438","","10.1007/s12630-020-01686-5"
"29716425","Early Prediction of Intensive Care Unit-Acquired Weakness: A Multicenter External Validation Study","Witteveen E, Wieske L, Sommers J, Spijkstra JJ, de Waard MC, Endeman H, Rijkenberg S, de Ruijter W, Sleeswijk M, Verhamme C, Schultz MJ, van Schaik IN, Horn J.","J Intensive Care Med. 2020 Jun;35(6):595-605. doi: 10.1177/0885066618771001. Epub 2018 May 1.","Witteveen E","J Intensive Care Med","2020","2018/05/03","PMC7222288","","10.1177/0885066618771001"
"34154530","Modelling hospital outcome: problems with endogeneity","Moran JL, Santamaria JD, Duke GJ; Australian & New Zealand Intensive Care Society (ANZICS) Centre for Outcomes & Resource Evaluation (CORE).","BMC Med Res Methodol. 2021 Jun 21;21(1):124. doi: 10.1186/s12874-021-01251-8.","Moran JL","BMC Med Res Methodol","2021","2021/06/22","PMC8215743","","10.1186/s12874-021-01251-8"
"26561522","Risk of postoperative acute kidney injury in patients undergoing orthopaedic surgery--development and validation of a risk score and effect of acute kidney injury on survival: observational cohort study","Bell S, Dekker FW, Vadiveloo T, Marwick C, Deshmukh H, Donnan PT, Van Diepen M.","BMJ. 2015 Nov 11;351:h5639. doi: 10.1136/bmj.h5639.","Bell S","BMJ","2015","2015/11/13","PMC4641433","","10.1136/bmj.h5639"
"38874054","Systematic Review and Meta-Analysis of Prehospital Machine Learning Scores as Screening Tools for Early Detection of Large Vessel Occlusion in Patients With Suspected Stroke","Alobaida M, Joddrell M, Zheng Y, Lip GYH, Rowe FJ, El-Bouri WK, Hill A, Lane DA, Harrison SL.","J Am Heart Assoc. 2024 Jun 18;13(12):e033298. doi: 10.1161/JAHA.123.033298. Epub 2024 Jun 14.","Alobaida M","J Am Heart Assoc","2024","2024/06/14","PMC11255760","","10.1161/JAHA.123.033298"
"34285316","Predicting critical state after COVID-19 diagnosis: model development using a large US electronic health record dataset","Rinderknecht MD, Klopfenstein Y.","NPJ Digit Med. 2021 Jul 20;4(1):113. doi: 10.1038/s41746-021-00482-9.","Rinderknecht MD","NPJ Digit Med","2021","2021/07/21","PMC8292360","","10.1038/s41746-021-00482-9"
"38816759","Predictive models of radiographic progression and pain progression in patients with knee osteoarthritis: data from the FNIH OA biomarkers consortium project","Li X, Li C, Zhang P.","Arthritis Res Ther. 2024 May 30;26(1):112. doi: 10.1186/s13075-024-03346-1.","Li X","Arthritis Res Ther","2024","2024/05/30","PMC11138003","","10.1186/s13075-024-03346-1"
"38886455","Development of a predictive nomogram for in-hospital death risk in multimorbid patients with hepatocellular carcinoma undergoing Palliative Locoregional Therapy","Yao R, Zheng B, Hu X, Ma B, Zheng J, Yao K.","Sci Rep. 2024 Jun 17;14(1):13938. doi: 10.1038/s41598-024-64457-y.","Yao R","Sci Rep","2024","2024/06/17","PMC11183254","","10.1038/s41598-024-64457-y"
"37153097","Assessment of risk scores to predict mortality of COVID-19 patients admitted to the intensive care unit","Nogueira MCA, Nobre V, Pires MC, Ramos LEF, Ribeiro YCNMB, Aguiar RLO, Vigil FMB, Gomes VMR, Santos CO, Miranda DM, Durães PAA, da Costa JM, Schwarzbold AV, Gomes AGDR, Pessoa BP, Matos CC, Cimini CCR, de Carvalho CA, Ponce D, Manenti ERF, Cenci EPA, Anschau F, Costa FCC, Nascimento FJM, Bartolazzi F, Grizende GMS, Vianna HR, Nepomuceno JC, Ruschel KB, Zandoná LB, de Castro LC, Souza MD, Carneiro M, Bicalho MAC, Vilaça MDN, Bonardi NPF, de Oliveira NR, Lutkmeier R, Francisco SC, Araújo SF, Delfino-Pereira P, Marcolino MS.","Front Med (Lausanne). 2023 Apr 20;10:1130218. doi: 10.3389/fmed.2023.1130218. eCollection 2023.","Nogueira MCA","Front Med (Lausanne)","2023","2023/05/08","PMC10157088","","10.3389/fmed.2023.1130218"
"37216518","Apple-shaped obesity: A risky soil for cytokine-accelerated severity in COVID-19","Hosoya T, Oba S, Komiya Y, Kawata D, Kamiya M, Iwai H, Miyamoto S, Kataoka M, Tobiume M, Kanno T, Ainai A, Sato H, Hirakawa A, Mitsui Y, Satoh T, Wakabayashi K, Yamada T, Otomo Y, Miyazaki Y, Hasegawa H, Suzuki T, Yasuda S.","Proc Natl Acad Sci U S A. 2023 May 30;120(22):e2300155120. doi: 10.1073/pnas.2300155120. Epub 2023 May 22.","Hosoya T","Proc Natl Acad Sci U S A","2023","2023/05/22","PMC10235975","","10.1073/pnas.2300155120"
"38767857","Comparing penalization methods for linear models on large observational health data","Fridgeirsson EA, Williams R, Rijnbeek P, Suchard MA, Reps JM.","J Am Med Inform Assoc. 2024 Jun 20;31(7):1514-1521. doi: 10.1093/jamia/ocae109.","Fridgeirsson EA","J Am Med Inform Assoc","2024","2024/05/20","PMC11187433","","10.1093/jamia/ocae109"
"34233992","Disentangling treatment pathways for knee osteoarthritis: a study protocol for the TREATright study including a prospective cohort study, a qualitative study and a cost-effectiveness study","Bruhn SM, Ingelsrud LH, Bandholm T, Skou ST, Schroder HM, Reventlow S, Møller A, Kjellberg J, Kallemose T, Troelsen A.","BMJ Open. 2021 Jul 7;11(7):e048411. doi: 10.1136/bmjopen-2020-048411.","Bruhn SM","BMJ Open","2021","2021/07/08","PMC8264876","","10.1136/bmjopen-2020-048411"
"34234498","External Validation of the Prognostic Prediction Model for 4-Year Risk of Metabolic Syndrome in Adults: A Retrospective Cohort Study","Zhang H, Chen D, Shao J, Zou P, Cui N, Tang L, Wang X, Wang D, Ye Z.","Diabetes Metab Syndr Obes. 2021 Jul 1;14:3027-3034. doi: 10.2147/DMSO.S316950. eCollection 2021.","Zhang H","Diabetes Metab Syndr Obes","2021","2021/07/08","PMC8257261","","10.2147/DMSO.S316950"
"37223852","Implementing Reporting Standards for Polygenic Risk Scores for Atherosclerotic Cardiovascular Disease","Smith JL, Schaid DJ, Kullo IJ.","Curr Atheroscler Rep. 2023 Jun;25(6):323-330. doi: 10.1007/s11883-023-01104-3. Epub 2023 May 24.","Smith JL","Curr Atheroscler Rep","2023","2023/05/24","PMC10495216","NIHMS1918663","10.1007/s11883-023-01104-3"
"34604031","Clinical Features and Serological Markers Risk Model Predicts Overall Survival in Patients Undergoing Breast Cancer and Bone Metastasis Surgeries","Mou H, Wang Z, Zhang W, Li G, Zhou H, Yinwang E, Wang F, Sun H, Xue Y, Wang Z, Chen T, Chai X, Qu H, Lin P, Teng W, Li B, Ye Z.","Front Oncol. 2021 Sep 17;11:693689. doi: 10.3389/fonc.2021.693689. eCollection 2021.","Mou H","Front Oncol","2021","2021/10/04","PMC8484887","","10.3389/fonc.2021.693689"
"28274964","Predicting AKI in emergency admissions: an external validation study of the acute kidney injury prediction score (APS)","Hodgson LE, Dimitrov BD, Roderick PJ, Venn R, Forni LG.","BMJ Open. 2017 Mar 8;7(3):e013511. doi: 10.1136/bmjopen-2016-013511.","Hodgson LE","BMJ Open","2017","2017/03/10","PMC5353262","","10.1136/bmjopen-2016-013511"
"34559325","Admission serum myoglobin and the development of acute kidney injury after major trauma","Tarazona V, Figueiredo S, Hamada S, Pochard J, Haines RW, Prowle JR, Duranteau J, Vigué B, Harrois A.","Ann Intensive Care. 2021 Sep 24;11(1):140. doi: 10.1186/s13613-021-00924-3.","Tarazona V","Ann Intensive Care","2021","2021/09/24","PMC8463647","","10.1186/s13613-021-00924-3"
"28969592","External validation study of a clinical decision aid to reduce unnecessary antibiotic prescriptions in women with acute cystitis","McIsaac WJ, Moineddin R, Gágyor I, Mazzulli T.","BMC Fam Pract. 2017 Oct 2;18(1):89. doi: 10.1186/s12875-017-0660-y.","McIsaac WJ","BMC Fam Pract","2017","2017/10/04","PMC5625594","","10.1186/s12875-017-0660-y"
"33190515","Precise Prediction of Total Body Lean and Fat Mass From Anthropometric and Demographic Data: Development and Validation of Neural Network Models","Cichosz SL, Rasmussen NH, Vestergaard P, Hejlesen O.","J Diabetes Sci Technol. 2021 Nov;15(6):1337-1343. doi: 10.1177/1932296820971348. Epub 2020 Nov 16.","Cichosz SL","J Diabetes Sci Technol","2021","2020/11/16","PMC8655297","","10.1177/1932296820971348"
"33149901","Development and external validation of an acute kidney injury risk score for use in the general population","Bell S, James MT, Farmer CKT, Tan Z, de Souza N, Witham MD.","Clin Kidney J. 2020 Jul 16;13(3):402-412. doi: 10.1093/ckj/sfaa072. eCollection 2020 Jun.","Bell S","Clin Kidney J","2020","2020/11/05","PMC7596889","","10.1093/ckj/sfaa072"
"33167554","A Feasibility Study Using a Machine Learning Suicide Risk Prediction Model Based on Open-Ended Interview Language in Adolescent Therapy Sessions","Cohen J, Wright-Berryman J, Rohlfs L, Wright D, Campbell M, Gingrich D, Santel D, Pestian J.","Int J Environ Res Public Health. 2020 Nov 5;17(21):8187. doi: 10.3390/ijerph17218187.","Cohen J","Int J Environ Res Public Health","2020","2020/11/10","PMC7663991","","10.3390/ijerph17218187"
"33239114","Development and validation of the patient history COVID-19 (PH-Covid19) scoring system: a multivariable prediction model of death in Mexican patients with COVID-19","Mancilla-Galindo J, Vera-Zertuche JM, Navarro-Cruz AR, Segura-Badilla O, Reyes-Velázquez G, Tepepa-López FJ, Aguilar-Alonso P, Vidal-Mayo JJ, Kammar-García A.","Epidemiol Infect. 2020 Nov 26;148:e286. doi: 10.1017/S0950268820002903.","Mancilla-Galindo J","Epidemiol Infect","2020","2020/11/26","PMC7729170","","10.1017/S0950268820002903"
"39553229","Development and validation of a machine learning-based model to predict postoperative overall survival in patients with soft tissue sarcoma: a retrospective cohort study","Liu X, Yuan J, Wang X, Yu S.","Am J Cancer Res. 2024 Oct 15;14(10):4731-4746. doi: 10.62347/ZQVY3877. eCollection 2024.","Liu X","Am J Cancer Res","2024","2024/11/18","PMC11560808","","10.62347/ZQVY3877"
"39603208","Development and validation of a radiomic prediction model for TACC3 expression and prognosis in non-small cell lung cancer using contrast-enhanced CT imaging","Bai W, Zhao X, Ning Q.","Transl Oncol. 2025 Jan;51:102211. doi: 10.1016/j.tranon.2024.102211. Epub 2024 Nov 27.","Bai W","Transl Oncol","2025","2024/11/27","PMC11635781","","10.1016/j.tranon.2024.102211"
"35435444","Troubling Aspects of the Trabecular Bone Score Adjustment for the Fracture Risk Assessment Tool (FRAX®)","Mayer M, Greenblatt A.","Calcif Tissue Int. 2022 Aug;111(2):224-225. doi: 10.1007/s00223-022-00982-0. Epub 2022 Apr 18.","Mayer M","Calcif Tissue Int","2022","2022/04/18","","","10.1007/s00223-022-00982-0"
"38609314","Development of an enhanced scoring system to predict ICU readmission or in-hospital death within 24 hours using routine patient data from two NHS Foundation Trusts","Pimentel MAF, Johnson A, Darbyshire JL, Tarassenko L, Clifton DA, Walden A, Rechner I, Watkinson PJ, Young JD.","BMJ Open. 2024 Apr 12;14(4):e074604. doi: 10.1136/bmjopen-2023-074604.","Pimentel MAF","BMJ Open","2024","2024/04/12","PMC11029184","","10.1136/bmjopen-2023-074604"
"39711957","Clinical predictive models for recurrence and survival in treated laryngeal and hypopharyngeal cancer: a systematic review and meta-analysis","Abou-Foul AK, Dretzke J, Albon E, Kristunas C, Moore DJ, Karwath A, Gkoutos G, Mehanna H, Nankivell P; PETNECK2 Research Team.","Front Oncol. 2024 Dec 6;14:1478385. doi: 10.3389/fonc.2024.1478385. eCollection 2024.","Abou-Foul AK","Front Oncol","2024","2024/12/23","PMC11659268","","10.3389/fonc.2024.1478385"
"38087052","Artificial intelligence in the practice of forensic medicine: a scoping review","Tournois L, Trousset V, Hatsch D, Delabarde T, Ludes B, Lefèvre T.","Int J Legal Med. 2024 May;138(3):1023-1037. doi: 10.1007/s00414-023-03140-9. Epub 2023 Dec 13.","Tournois L","Int J Legal Med","2024","2023/12/12","PMC11003914","","10.1007/s00414-023-03140-9"
"39381822","Machine learning in female urinary incontinence: A scoping review","Wang Q, Wang X, Jiang X, Lin C.","Digit Health. 2024 Oct 7;10:20552076241281450. doi: 10.1177/20552076241281450. eCollection 2024 Jan-Dec.","Wang Q","Digit Health","2024","2024/10/09","PMC11459541","","10.1177/20552076241281450"
"39711671","The Perioperative NonaGEnaRIan And cenTenarian suRgICal (GERIATRIC) Risk Stratification Tool","Weinberg L, Lee DK, Fletcher L, Ou Yang B, Karp J, Koshy AN, Guha R, Slifirski H, D'Silva MR, Bellomo R, Churilov L.","Ann Surg Open. 2024 Nov 18;5(4):e524. doi: 10.1097/AS9.0000000000000524. eCollection 2024 Dec.","Weinberg L","Ann Surg Open","2024","2024/12/23","PMC11661723","","10.1097/AS9.0000000000000524"
"39941377","Development and Validation of a Quantitative Score for the Criteria Clinical Control in Stable COPD Proposed in the Spanish COPD Guidelines (GesEPOC): Results of the EPOCONSUL Audit","Calle Rubio M, Cataluña JJS, Miravitlles M, Navarrete BA, López-Campos JL, Ferrer MEF, Rodríguez Hermosa JL.","J Clin Med. 2025 Jan 22;14(3):707. doi: 10.3390/jcm14030707.","Calle Rubio M","J Clin Med","2025","2025/02/13","PMC11818294","","10.3390/jcm14030707"
"39963160","Artificial intelligence-based prediction of second stage duration in labor: a multicenter retrospective cohort analysis","Huang X, Di X, Lin S, Yao M, Zheng S, Liu S, Lau W, Ye Z, Wang Z, Liu B.","EClinicalMedicine. 2025 Jan 20;80:103072. doi: 10.1016/j.eclinm.2025.103072. eCollection 2025 Feb.","Huang X","EClinicalMedicine","2025","2025/02/18","PMC11831126","","10.1016/j.eclinm.2025.103072"
"34048066","A two-stage prediction model for heterogeneous effects of treatments","Chalkou K, Steyerberg E, Egger M, Manca A, Pellegrini F, Salanti G.","Stat Med. 2021 Sep 10;40(20):4362-4375. doi: 10.1002/sim.9034. Epub 2021 May 27.","Chalkou K","Stat Med","2021","2021/05/28","PMC9291845","","10.1002/sim.9034"
"39168295","Improved diagnosis of arrhythmogenic right ventricular cardiomyopathy using electrocardiographic deep learning","Carrick RT, Carruth ED, Gasperetti A, Murray B, Tichnell C, Gaine S, Sampognaro J, Muller SA, Asatryan B, Haggerty C, Thiemann D, Calkins H, James CA, Wu KC.","Heart Rhythm. 2025 Apr;22(4):1080-1088. doi: 10.1016/j.hrthm.2024.08.030. Epub 2024 Aug 20.","Carrick RT","Heart Rhythm","2025","2024/08/21","PMC11839954","NIHMS2019240","10.1016/j.hrthm.2024.08.030"
"40065124","Widely accessible prognostication using medical history for fetal growth restriction and small for gestational age in nationwide insured women","Sufriyana H, Amani FZ, Al Hajiri AZZ, Wu YW, Su EC.","Sci Rep. 2025 Mar 11;15(1):8340. doi: 10.1038/s41598-025-92986-7.","Sufriyana H","Sci Rep","2025","2025/03/11","PMC11894118","","10.1038/s41598-025-92986-7"
"40170112","A diagnostic model for assessing the risk of osteoporosis in patients with rheumatoid arthritis based on bone turnover markers","Shao Y, Yang Y, Yang X, Xu Z, Zhang H, Li N, Xu H, Zhao Y, Wang Y, Shi Q, Liang Q.","Arthritis Res Ther. 2025 Apr 1;27(1):75. doi: 10.1186/s13075-025-03544-5.","Shao Y","Arthritis Res Ther","2025","2025/04/01","PMC11959775","","10.1186/s13075-025-03544-5"
"40189929","Development and validation of a prediction model for in-hospital mortality in patients with sepsis","Shi W, Xie M, Mao E, Yang Z, Zhang Q, Chen E, Chen Y.","Nurs Crit Care. 2025 May;30(3):e70015. doi: 10.1111/nicc.70015.","Shi W","Nurs Crit Care","2025","2025/04/07","PMC11973470","","10.1111/nicc.70015"
"25561516","Transparent reporting of a multivariable prediction model for individual prognosis or diagnosis (TRIPOD): the TRIPOD statement. The TRIPOD Group","Collins GS, Reitsma JB, Altman DG, Moons KG; TRIPOD Group.","Circulation. 2015 Jan 13;131(2):211-9. doi: 10.1161/CIRCULATIONAHA.114.014508. Epub 2015 Jan 5.","Collins GS","Circulation","2015","2015/01/07","PMC4297220","","10.1161/CIRCULATIONAHA.114.014508"
"38296400","Universal Risk Prediction for Individuals With and Without Atherosclerotic Cardiovascular Disease","Mok Y, Dardari Z, Sang Y, Hu X, Bancks MP, Mathews L, Hoogeveen RC, Koton S, Blaha MJ, Post WS, Ballantyne CM, Coresh J, Rosamond W, Matsushita K.","J Am Coll Cardiol. 2024 Feb 6;83(5):562-573. doi: 10.1016/j.jacc.2023.11.028.","Mok Y","J Am Coll Cardiol","2024","2024/01/31","PMC11702005","NIHMS2040334","10.1016/j.jacc.2023.11.028"
"33390155","Development and validation of a lifestyle-based model for colorectal cancer risk prediction: the LiFeCRC score","Aleksandrova K, Reichmann R, Kaaks R, Jenab M, Bueno-de-Mesquita HB, Dahm CC, Eriksen AK, Tjønneland A, Artaud F, Boutron-Ruault MC, Severi G, Hüsing A, Trichopoulou A, Karakatsani A, Peppa E, Panico S, Masala G, Grioni S, Sacerdote C, Tumino R, Elias SG, May AM, Borch KB, Sandanger TM, Skeie G, Sánchez MJ, Huerta JM, Sala N, Gurrea AB, Quirós JR, Amiano P, Berntsson J, Drake I, van Guelpen B, Harlid S, Key T, Weiderpass E, Aglago EK, Cross AJ, Tsilidis KK, Riboli E, Gunter MJ.","BMC Med. 2021 Jan 4;19(1):1. doi: 10.1186/s12916-020-01826-0.","Aleksandrova K","BMC Med","2021","2021/01/04","PMC7780676","","10.1186/s12916-020-01826-0"
"31690548","Individual participant data validation of the PICNICC prediction model for febrile neutropenia","Phillips B, Morgan JE, Haeusler GM, Riley RD; PICNICC Collaborative.","Arch Dis Child. 2020 May;105(5):439-445. doi: 10.1136/archdischild-2019-317308. Epub 2019 Nov 5.","Phillips B","Arch Dis Child","2020","2019/11/07","PMC7212933","","10.1136/archdischild-2019-317308"
"33302525","Identifying Ovarian Cancer in Symptomatic Women: A Systematic Review of Clinical Tools","Funston G, Hardy V, Abel G, Crosbie EJ, Emery J, Hamilton W, Walter FM.","Cancers (Basel). 2020 Dec 8;12(12):3686. doi: 10.3390/cancers12123686.","Funston G","Cancers (Basel)","2020","2020/12/11","PMC7764009","","10.3390/cancers12123686"
"35794668","Risk of bias of prognostic models developed using machine learning: a systematic review in oncology","Dhiman P, Ma J, Andaur Navarro CL, Speich B, Bullock G, Damen JAA, Hooft L, Kirtley S, Riley RD, Van Calster B, Moons KGM, Collins GS.","Diagn Progn Res. 2022 Jul 7;6(1):13. doi: 10.1186/s41512-022-00126-w.","Dhiman P","Diagn Progn Res","2022","2022/07/06","PMC9261114","","10.1186/s41512-022-00126-w"
"38224968","Evaluation of clinical prediction models (part 2): how to undertake an external validation study","Riley RD, Archer L, Snell KIE, Ensor J, Dhiman P, Martin GP, Bonnett LJ, Collins GS.","BMJ. 2024 Jan 15;384:e074820. doi: 10.1136/bmj-2023-074820.","Riley RD","BMJ","2024","2024/01/15","PMC10788734","","10.1136/bmj-2023-074820"
"36750242","Transparent reporting of multivariable prediction models developed or validated using clustered data: TRIPOD-Cluster checklist","Debray TPA, Collins GS, Riley RD, Snell KIE, Van Calster B, Reitsma JB, Moons KGM.","BMJ. 2023 Feb 7;380:e071018. doi: 10.1136/bmj-2022-071018.","Debray TPA","BMJ","2023","2023/02/07","PMC9903175","","10.1136/bmj-2022-071018"
"35033494","Understanding and Improving Risk Assessment After Myocardial Infarction Using Automated Left Ventricular Shape Analysis","Corral Acero J, Schuster A, Zacur E, Lange T, Stiermaier T, Backhaus SJ, Thiele H, Bueno-Orovio A, Lamata P, Eitel I, Grau V.","JACC Cardiovasc Imaging. 2022 Sep;15(9):1563-1574. doi: 10.1016/j.jcmg.2021.11.027. Epub 2022 Jan 12.","Corral Acero J","JACC Cardiovasc Imaging","2022","2022/01/16","PMC9444994","","10.1016/j.jcmg.2021.11.027"
"40359510","Predictive Modeling of Acute Respiratory Distress Syndrome Using Machine Learning: Systematic Review and Meta-Analysis","Yang J, Zeng S, Cui S, Zheng J, Wang H.","J Med Internet Res. 2025 May 13;27:e66615. doi: 10.2196/66615.","Yang J","J Med Internet Res","2025","2025/05/13","PMC12117268","","10.2196/66615"
"27189013","Opportunities and challenges in developing risk prediction models with electronic health records data: a systematic review","Goldstein BA, Navar AM, Pencina MJ, Ioannidis JP.","J Am Med Inform Assoc. 2017 Jan;24(1):198-208. doi: 10.1093/jamia/ocw042. Epub 2016 May 17.","Goldstein BA","J Am Med Inform Assoc","2017","2016/05/19","PMC5201180","","10.1093/jamia/ocw042"
"34019128","Performance of machine learning algorithms for glioma segmentation of brain MRI: a systematic literature review and meta-analysis","van Kempen EJ, Post M, Mannil M, Witkam RL, Ter Laan M, Patel A, Meijer FJA, Henssen D.","Eur Radiol. 2021 Dec;31(12):9638-9653. doi: 10.1007/s00330-021-08035-0. Epub 2021 May 21.","van Kempen EJ","Eur Radiol","2021","2021/05/21","PMC8589805","","10.1007/s00330-021-08035-0"
"40463640","Creation of a Rehabilitation Prediction Rule: a Prioritization Procedure","Wu P, Goodarzi Z, McMillan J.","Can Geriatr J. 2025 Jun 4;28(2):161-168. doi: 10.5770/cgj.28.826. eCollection 2025 Jun.","Wu P","Can Geriatr J","2025","2025/06/04","PMC12094087","","10.5770/cgj.28.826"
"40620237","Development and external validation of the LEAN score to predict late seizures after intracerebral haemorrhage","Reitsma FJ, van Kuijk SM, Werring DJ, Banerjee G, Cordonnier C, Kaaouana O, Puy L, Biffi A, Viswanathan A, van Oostenbrugge RJ, Staals J, Rouhl RP.","Eur Stroke J. 2025 Jul 7:23969873251350882. doi: 10.1177/23969873251350882. Online ahead of print.","Reitsma FJ","Eur Stroke J","2025","2025/07/07","PMC12234504","","10.1177/23969873251350882"
"37505221","Serum identification of at-risk MASH: The metabolomics-advanced steatohepatitis fibrosis score (MASEF)","Noureddin M, Truong E, Mayo R, Martínez-Arranz I, Mincholé I, Banales JM, Arrese M, Cusi K, Arias-Loste MT, Bruha R, Romero-Gómez M, Iruzubieta P, Aller R, Ampuero J, Calleja JL, Ibañez-Samaniego L, Aspichueta P, Martín-Duce A, Kushner T, Ortiz P, Harrison SA, Anstee QM, Crespo J, Mato JM, Sanyal AJ.","Hepatology. 2024 Jan 1;79(1):135-148. doi: 10.1097/HEP.0000000000000542. Epub 2023 Jul 24.","Noureddin M","Hepatology","2024","2023/07/28","PMC10718221","","10.1097/HEP.0000000000000542"
"40101246","Novel composite health assessment risk model for older allogeneic transplant recipients: BMT-CTN 1704","Sorror ML, Saber W, Logan B, Geller N, Bellach A, Kou J, Wood W, McCarty JM, Knight TG, Runaas L, Johnston L, Walston J, Nakamura R, Jarrett L, Mishra A, Uberti J, Dahi PB, Saultz JN, McCurdy SR, Morris LE, Imus PH, Hogan WJ, Nadiminti K, Bhatt VR, Olin R, Maakaron J, Sobecks R, Wall SA, Mattila D, Protz B, Devine SM, Horowitz MM, Artz AS.","Blood Adv. 2025 Jul 8;9(13):3268-3280. doi: 10.1182/bloodadvances.2025015793.","Sorror ML","Blood Adv","2025","2025/03/18","PMC12246602","","10.1182/bloodadvances.2025015793"
"37790131","Prediction of lactate concentrations after cardiac surgery using machine learning and deep learning approaches","Kobayashi Y, Peng YC, Yu E, Bush B, Jung YH, Murphy Z, Goeddel L, Whitman G, Venkataraman A, Brown CH 4th.","Front Med (Lausanne). 2023 Sep 14;10:1165912. doi: 10.3389/fmed.2023.1165912. eCollection 2023.","Kobayashi Y","Front Med (Lausanne)","2023","2023/10/04","PMC10543087","","10.3389/fmed.2023.1165912"
"38049159","Derivation of the Falls Decision Rule to exclude intracranial bleeding without head CT in older adults who have fallen","de Wit K, Mercuri M, Clayton N, Mercier É, Morris J, Jeanmonod R, Eagles D, Varner C, Barbic D, Buchanan IM, Ali M, Kagoma YK, Shoamanesh A, Engels P, Sharma S, Worster A, McLeod S, Émond M, Stiell I, Papaioannou A, Parpia S; Network of Canadian Emergency Researchers.","CMAJ. 2023 Dec 3;195(47):E1614-E1621. doi: 10.1503/cmaj.230634.","de Wit K","CMAJ","2023","2023/12/04","PMC10699318","","10.1503/cmaj.230634"
"36523225","External validation of the risk prediction model for early diabetic kidney disease in Taiwan population: a retrospective cohort study","Sun Z, Wang K, Miller JD, Yuan X, Lee YJ, Lou Q.","BMJ Open. 2022 Dec 13;12(12):e059139. doi: 10.1136/bmjopen-2021-059139.","Sun Z","BMJ Open","2022","2022/12/16","PMC9748925","","10.1136/bmjopen-2021-059139"
"39601435","Prediction Model for Polyneuropathy in Recent-Onset Diabetes Based on Serum Neurofilament Light Chain, Fibroblast Growth Factor-19 and Standard Anthropometric and Clinical Variables","Maalmi H, Nguyen PBH, Strom A, Bönhof GJ, Rathmann W, Ziegler D, Menden MP, Roden M, Herder C; GDS Group.","Diabetes Metab Res Rev. 2024 Nov;40(8):e70009. doi: 10.1002/dmrr.70009.","Maalmi H","Diabetes Metab Res Rev","2024","2024/11/27","PMC11601145","","10.1002/dmrr.70009"
"40020934","Respiratory and nonrespiratory symptoms before age 1 year predict school-age asthma","Rabe BA, Stern DA, Carr TF, Billheimer D, Martinez FD.","J Allergy Clin Immunol. 2025 Aug;156(2):352-360. doi: 10.1016/j.jaci.2025.02.023. Epub 2025 Feb 26.","Rabe BA","J Allergy Clin Immunol","2025","2025/02/28","PMC12331433","NIHMS2067930","10.1016/j.jaci.2025.02.023"
"27436868","Moving beyond regression techniques in cardiovascular risk prediction: applying machine learning to address analytic challenges","Goldstein BA, Navar AM, Carter RE.","Eur Heart J. 2017 Jun 14;38(23):1805-1814. doi: 10.1093/eurheartj/ehw302.","Goldstein BA","Eur Heart J","2017","2016/07/21","PMC5837244","","10.1093/eurheartj/ehw302"
"39304672","Prediction of preterm birth in multiparous women using logistic regression and machine learning approaches","Belaghi RA.","Sci Rep. 2024 Sep 20;14(1):21967. doi: 10.1038/s41598-024-60097-4.","Belaghi RA","Sci Rep","2024","2024/09/20","PMC11415355","","10.1038/s41598-024-60097-4"
"36104486","Discrete-time survival analysis in the critically ill: a deep learning approach using heterogeneous data","Thorsen-Meyer HC, Placido D, Kaas-Hansen BS, Nielsen AP, Lange T, Nielsen AB, Toft P, Schierbeck J, Strøm T, Chmura PJ, Heimann M, Belling K, Perner A, Brunak S.","NPJ Digit Med. 2022 Sep 14;5(1):142. doi: 10.1038/s41746-022-00679-6.","Thorsen-Meyer HC","NPJ Digit Med","2022","2022/09/14","PMC9474816","","10.1038/s41746-022-00679-6"
