PMID,Title,Authors,Citation,First Author,Journal/Book,Publication Year,Create Date,PMCID,NIHMS ID,DOI
"33852918","Breast and Lung Effusion Survival Score Models: Improving Survival Prediction in Patients With Malignant Pleural Effusion and Metastasis","Molina S, Martinez-Zayas G, Sainz PV, Leung CH, Li L, Grosu HB, Adachi R, Ost DE.","Chest. 2021 Sep;160(3):1075-1094. doi: 10.1016/j.chest.2021.03.059. Epub 2021 May 11.","Molina S","Chest","2021","2021/04/14","PMC8449006","","10.1016/j.chest.2021.03.059"
"39310580","Predictive Factors for the Healing of Rotator Cuff Repairs","Beraldo RA, Assunção JH, Helito PV, Macedo Pontes IC, Gracitelli MEC, Checchia C, Brandão F, Ferreira Neto AA, Vasques T, Malavolta EA.","Cureus. 2024 Aug 23;16(8):e67608. doi: 10.7759/cureus.67608. eCollection 2024 Aug.","Beraldo RA","Cureus","2024","2024/09/23","PMC11416824","","10.7759/cureus.67608"
"36283756","Canadian infants presenting with Brief Resolved Unexplained Events (BRUEs) and validation of clinical prediction rules for risk stratification: a protocol for a multicentre, retrospective cohort study","Nama N, Hosseini P, Lee Z, Picco K, Bone JN, Foulds JL, Gagnon JA, Sehgal A, Quet J, Drouin O, Luu TM, Vomiero G, Kanani R, Holland J, Goldman RD, Kang KT, Mahant S, Jin F, Tieder JS, Gill PJ; Canadian Paediatric Inpatient Research Network (PIRN).","BMJ Open. 2022 Oct 25;12(10):e063183. doi: 10.1136/bmjopen-2022-063183.","Nama N","BMJ Open","2022","2022/10/25","PMC9608523","","10.1136/bmjopen-2022-063183"
"36112135","The Khorana score and venous and arterial thrombosis in patients with cancer treated with immune checkpoint inhibitors: A Danish cohort study","Overvad TF, Skjøth F, Piazza G, Noble S, Ording AG, Larsen TB, Nielsen PB.","J Thromb Haemost. 2022 Dec;20(12):2921-2929. doi: 10.1111/jth.15883. Epub 2022 Oct 7.","Overvad TF","J Thromb Haemost","2022","2022/09/16","PMC9828438","","10.1111/jth.15883"
"36389426","Development of a prediction model to estimate the 5-year risk of cardiovascular events and all-cause mortality in haemodialysis patients: a retrospective study","Zhang A, Qi L, Zhang Y, Ren Z, Zhao C, Wang Q, Ren K, Bai J, Cao N.","PeerJ. 2022 Nov 9;10:e14316. doi: 10.7717/peerj.14316. eCollection 2022.","Zhang A","PeerJ","2022","2022/11/17","PMC9653067","","10.7717/peerj.14316"
"36125184","Machine Learning-Based Prediction of Elevated PTH Levels Among the US General Population","Kato H, Hoshino Y, Hidaka N, Ito N, Makita N, Nangaku M, Inoue K.","J Clin Endocrinol Metab. 2022 Nov 25;107(12):3222-3230. doi: 10.1210/clinem/dgac544.","Kato H","J Clin Endocrinol Metab","2022","2022/09/20","PMC9693802","","10.1210/clinem/dgac544"
"37969816","Prediction of early recurrence in patients with colorectal liver metastases","Liao X, Chi J, Xia Q, Sun L.","J Gastrointest Oncol. 2023 Oct 31;14(5):2279-2281. doi: 10.21037/jgo-23-653. Epub 2023 Oct 23.","Liao X","J Gastrointest Oncol","2023","2023/11/16","PMC10643582","","10.21037/jgo-23-653"
"39139377","MetaBakery: a Singularity implementation of bioBakery tools as a skeleton application for efficient HPC deconvolution of microbiome metagenomic sequencing data to machine learning ready information","Murovec B, Deutsch L, Osredkar D, Stres B.","Front Microbiol. 2024 Jul 30;15:1426465. doi: 10.3389/fmicb.2024.1426465. eCollection 2024.","Murovec B","Front Microbiol","2024","2024/08/14","PMC11321593","","10.3389/fmicb.2024.1426465"
"38347044","Development and validation of predictive nomogram for postoperative non-union of closed femoral shaft fracture","Li W, Wang Y, Zhou S, Liu S, Di L, Chen W, Lv H.","Sci Rep. 2024 Feb 12;14(1):3543. doi: 10.1038/s41598-024-53356-x.","Li W","Sci Rep","2024","2024/02/12","PMC10861573","","10.1038/s41598-024-53356-x"
"33022026","A protocol for the development and internal validation of a model to predict clinical response to antihistamines in urticaria patients","Sanchez J, Velasquez M, Jaimes F.","PLoS One. 2020 Oct 6;15(10):e0239962. doi: 10.1371/journal.pone.0239962. eCollection 2020.","Sanchez J","PLoS One","2020","2020/10/06","PMC7537877","","10.1371/journal.pone.0239962"
"36188378","Speed up discharge planning at the acute stroke unit: A development and external validation study for the early prediction of discharge home","Veerbeek JM, Ottiger B, Cazzoli D, Vanbellingen T, Nyffeler T.","Front Neurol. 2022 Sep 16;13:999595. doi: 10.3389/fneur.2022.999595. eCollection 2022.","Veerbeek JM","Front Neurol","2022","2022/10/03","PMC9523004","","10.3389/fneur.2022.999595"
"38409858","A tool to predict the risk of lower extremity amputation in patients starting dialysis","Akerboom B, Janse RJ, Caldinelli A, Lindholm B, Rotmans JI, Evans M, van Diepen M.","Nephrol Dial Transplant. 2024 Sep 27;39(10):1672-1682. doi: 10.1093/ndt/gfae050.","Akerboom B","Nephrol Dial Transplant","2024","2024/02/27","PMC11427081","","10.1093/ndt/gfae050"
"38107648","Upper limb sensorimotor recovery in Asian stroke survivors: a study protocol for the development and implementation of a Technology-Assisted dIgitaL biOmaRker (TAILOR) platform","Cheng HJ, Chin LF, Kanzler CM, Lehner R, Kuah CWK, Kager S, Josse E, Samkharadze T, Sidarta A, Gonzalez PC, Lie E, Zbytniewska-Mégret M, Wee SK, Liang P, Gassert R, Chua K, Lambercy O, Wenderoth N.","Front Neurol. 2023 Nov 30;14:1246888. doi: 10.3389/fneur.2023.1246888. eCollection 2023.","Cheng HJ","Front Neurol","2023","2023/12/18","PMC10722087","","10.3389/fneur.2023.1246888"
"36482400","Development and validation of a new nomogram to screen for MAFLD","Zou H, Zhao F, Lv X, Ma X, Xie Y.","Lipids Health Dis. 2022 Dec 8;21(1):133. doi: 10.1186/s12944-022-01748-1.","Zou H","Lipids Health Dis","2022","2022/12/09","PMC9730620","","10.1186/s12944-022-01748-1"
"38360681","External validation of the HACOR score and ROX index for predicting treatment failure in patients with coronavirus disease 2019 pneumonia managed on high-flow nasal cannula therapy: a multicenter retrospective observational study in Japan","Okano H, Yamamoto R, Iwasaki Y, Irimada D, Konno D, Tanaka T, Oishi T, Nawa H, Yano A, Taniguchi H, Otawara M, Matsuoka A, Yamauchi M.","J Intensive Care. 2024 Feb 15;12(1):7. doi: 10.1186/s40560-024-00720-8.","Okano H","J Intensive Care","2024","2024/02/15","PMC10870626","","10.1186/s40560-024-00720-8"
"32750312","Noninvasive Prediction of Elevated Wedge Pressure in Pulmonary Hypertension Patients Without Clear Signs of Left-Sided Heart Disease: External Validation of the OPTICS Risk Score","Jansen SMA, Huis In 't Veld AE, Jacobs W, Grotjohan HP, Waskowsky M, van der Maten J, van der Weerdt A, Hoekstra R, Overbeek MJ, Mollema SA, Tolen PHCG, Hassan El Bouazzaoui LH, Vriend JWJ, Roorda JMM, de Nooijer R, van der Lee I, Voogel BAJ, Peels K, Macken T, Aerts JM, Vonk Noordegraaf A, Handoko ML, de Man FS, Bogaard HJ.","J Am Heart Assoc. 2020 Aug 4;9(15):e015992. doi: 10.1161/JAHA.119.015992. Epub 2020 Jul 31.","Jansen SMA","J Am Heart Assoc","2020","2020/08/05","PMC7792270","","10.1161/JAHA.119.015992"
"38184316","Multicentre external validation of the prognostic model kidney failure risk equation in patients with CKD stages 3 and 4 in Peru: a retrospective cohort study","Bravo-Zúñiga J, Chávez-Gómez R, Soto-Becerra P.","BMJ Open. 2024 Jan 6;14(1):e076217. doi: 10.1136/bmjopen-2023-076217.","Bravo-Zúñiga J","BMJ Open","2024","2024/01/06","PMC10773413","","10.1136/bmjopen-2023-076217"
"38979796","A systematic review of fall prediction models for community-dwelling older adults: comparison between models based on research cohorts and models based on routinely collected data","Dormosh N, van de Loo B, Heymans MW, Schut MC, Medlock S, van Schoor NM, van der Velde N, Abu-Hanna A.","Age Ageing. 2024 Jul 2;53(7):afae131. doi: 10.1093/ageing/afae131.","Dormosh N","Age Ageing","2024","2024/07/09","PMC11231951","","10.1093/ageing/afae131"
"36844179","Prediction of Nonrelapse Mortality in Patients With Acute Myeloid Leukemia and Acute Lymphoblastic Leukemia Receiving Allogeneic Stem Cell Transplantation With Posttransplantation Cyclophosphamide-based Graft Versus Host Disease Prophylaxis","Hermans SJF, Versluis J, Labopin M, Giebel S, van Norden Y, Moiseev I, Blaise D, Díez Martín JL, Meijer E, Rovira M, Choi G, Raiola AM, Koc Y, Reményi P, Vydra J, Kröger N, Sica S, Martino M, van Gorkom G, Chevallier P, Busca A, Herrera Arroyo C, Brissot E, Peric Z, Nagler A, Shouval R, Ciceri F, Cornelissen JJ, Mohty M.","Hemasphere. 2023 Feb 21;7(3):e846. doi: 10.1097/HS9.0000000000000846. eCollection 2023 Mar.","Hermans SJF","Hemasphere","2023","2023/02/27","PMC9946411","","10.1097/HS9.0000000000000846"
"35507390","Clustering Diagnoses From 58 Million Patient Visits in Finland Between 2015 and 2018","Fränti P, Sieranoja S, Wikström K, Laatikainen T.","JMIR Med Inform. 2022 May 4;10(5):e35422. doi: 10.2196/35422.","Fränti P","JMIR Med Inform","2022","2022/05/04","PMC9118010","","10.2196/35422"
"36684365","Development and validation of a diagnostic model for differentiating tuberculous spondylitis from brucellar spondylitis using machine learning: A retrospective cohort study","Yasin P, Mardan M, Xu T, Cai X, Abulizi Y, Wang T, Sheng W, Mamat M.","Front Surg. 2023 Jan 6;9:955761. doi: 10.3389/fsurg.2022.955761. eCollection 2022.","Yasin P","Front Surg","2023","2023/01/23","PMC9852539","","10.3389/fsurg.2022.955761"
"30522837","Identification of urinary tract infections using electronic health record data","Colborn KL, Bronsert M, Hammermeister K, Henderson WG, Singh AB, Meguid RA.","Am J Infect Control. 2019 Apr;47(4):371-375. doi: 10.1016/j.ajic.2018.10.009. Epub 2018 Dec 4.","Colborn KL","Am J Infect Control","2019","2018/12/08","PMC6312639","NIHMS999253","10.1016/j.ajic.2018.10.009"
"31725665","The triglyceride glucose index can predict newly diagnosed biopsy-proven diabetic nephropathy in type 2 diabetes: A nested case control study","Shang J, Yu D, Cai Y, Wang Z, Zhao B, Zhao Z, Simmons D.","Medicine (Baltimore). 2019 Nov;98(46):e17995. doi: 10.1097/MD.0000000000017995.","Shang J","Medicine (Baltimore)","2019","2019/11/15","PMC6867726","","10.1097/MD.0000000000017995"
"36689101","Letter regarding ""Developing a predictive model for spinal shock in dogs with spinal cord injury""","Cummings CO.","J Vet Intern Med. 2023 Mar;37(2):400-401. doi: 10.1111/jvim.16631. Epub 2023 Jan 23.","Cummings CO","J Vet Intern Med","2023","2023/01/23","PMC10061182","","10.1111/jvim.16631"
"31572993","Prognostic Value of Blood Lactate and Base Deficit in Refractory Cardiac Arrest Cases Undergoing Extracorporeal Life Support","Jouffroy R, Philippe P, Saade A, Carli P, Vivien B.","Turk J Anaesthesiol Reanim. 2019 Oct;47(5):407-413. doi: 10.5152/TJAR.2019.65391. Epub 2019 Apr 24.","Jouffroy R","Turk J Anaesthesiol Reanim","2019","2019/10/02","PMC6756315","","10.5152/TJAR.2019.65391"
"36528686","Added value of histogram analysis of ADC in predicting radiation-induced temporal lobe injury of patients with nasopharyngeal carcinoma treated by intensity-modulated radiotherapy","Bao D, Zhao Y, Wu W, Zhong H, Yuan M, Li L, Lin M, Zhao X, Luo D.","Insights Imaging. 2022 Dec 17;13(1):197. doi: 10.1186/s13244-022-01338-w.","Bao D","Insights Imaging","2022","2022/12/17","PMC9759610","","10.1186/s13244-022-01338-w"
"35468829","Point-of-care prediction model of loop gain in patients with obstructive sleep apnea: development and validation","Schmickl CN, Orr JE, Kim P, Nokes B, Sands S, Manoharan S, McGinnis L, Parra G, DeYoung P, Owens RL, Malhotra A.","BMC Pulm Med. 2022 Apr 25;22(1):158. doi: 10.1186/s12890-022-01950-y.","Schmickl CN","BMC Pulm Med","2022","2022/04/26","PMC9036750","","10.1186/s12890-022-01950-y"
"35535237","Dengue Early Warning System as Outbreak Prediction Tool: A Systematic Review","Baharom M, Ahmad N, Hod R, Abdul Manaf MR.","Risk Manag Healthc Policy. 2022 May 3;15:871-886. doi: 10.2147/RMHP.S361106. eCollection 2022.","Baharom M","Risk Manag Healthc Policy","2022","2022/05/10","PMC9078425","","10.2147/RMHP.S361106"
"31748313","Early warning score adjusted for age to predict the composite outcome of mortality, cardiac arrest or unplanned intensive care unit admission using observational vital-sign data: a multicentre development and validation","Shamout F, Zhu T, Clifton L, Briggs J, Prytherch D, Meredith P, Tarassenko L, Watkinson PJ, Clifton DA.","BMJ Open. 2019 Nov 19;9(11):e033301. doi: 10.1136/bmjopen-2019-033301.","Shamout F","BMJ Open","2019","2019/11/22","PMC6887005","","10.1136/bmjopen-2019-033301"
"35137480","Towards identifying cancer patients at risk to miss out on psycho-oncological treatment via machine learning","Günther MP, Kirchebner J, Schulze JB, von Känel R, Euler S.","Eur J Cancer Care (Engl). 2022 Mar;31(2):e13555. doi: 10.1111/ecc.13555. Epub 2022 Feb 9.","Günther MP","Eur J Cancer Care (Engl)","2022","2022/02/09","PMC9286797","","10.1111/ecc.13555"
"35360720","An Online Pre-procedural Nomogram for the Prediction of Contrast-Associated Acute Kidney Injury in Patients Undergoing Coronary Angiography","Li D, Jiang H, Yang X, Lin M, Gao M, Chen Z, Fu G, Lai D, Zhang W.","Front Med (Lausanne). 2022 Mar 11;9:839856. doi: 10.3389/fmed.2022.839856. eCollection 2022.","Li D","Front Med (Lausanne)","2022","2022/04/01","PMC8961873","","10.3389/fmed.2022.839856"
"30292793","Characteristics Associated With High-Impact Pain in People With Temporomandibular Disorder: A Cross-Sectional Study","Miller VE, Poole C, Golightly Y, Barrett D, Chen DG, Ohrbach R, Greenspan JD, Fillingim RB, Slade GD.","J Pain. 2019 Mar;20(3):288-300. doi: 10.1016/j.jpain.2018.09.007. Epub 2018 Oct 4.","Miller VE","J Pain","2019","2018/10/08","PMC6424335","NIHMS1508842","10.1016/j.jpain.2018.09.007"
"31369887","Prediction of Severe Lymphopenia During Chemoradiation Therapy for Esophageal Cancer: Development and Validation of a Pretreatment Nomogram","van Rossum PSN, Deng W, Routman DM, Liu AY, Xu C, Shiraishi Y, Peters M, Merrell KW, Hallemeier CL, Mohan R, Lin SH.","Pract Radiat Oncol. 2020 Jan-Feb;10(1):e16-e26. doi: 10.1016/j.prro.2019.07.010. Epub 2019 Jul 29.","van Rossum PSN","Pract Radiat Oncol","2020","2019/08/02","PMC7564893","NIHMS1628311","10.1016/j.prro.2019.07.010"
"35145636","Translational research in nephrology: prognosis","Tripepi G, Bolignano D, Jager KJ, Dekker FW, Stel VS, Zoccali C.","Clin Kidney J. 2021 Aug 26;15(2):205-212. doi: 10.1093/ckj/sfab157. eCollection 2022 Feb.","Tripepi G","Clin Kidney J","2021","2022/02/11","PMC8825211","","10.1093/ckj/sfab157"
"30069332","Surgery for pulmonary metastases from colorectal cancer: survival and prognostic factors","Al-Ameri M, Persson M, Bergman P, Franco-Cereceda A, Sartipy U.","J Thorac Dis. 2018 Jun;10(6):3372-3380. doi: 10.21037/jtd.2018.05.120.","Al-Ameri M","J Thorac Dis","2018","2018/08/03","PMC6051780","","10.21037/jtd.2018.05.120"
"35438830","Postdischarge health resource use in pediatric survivors of prolonged mechanical ventilation for acute respiratory illness","Vo M, Miller K, Bennett TD, Mourani PM, LaVelle J, Carpenter TC, Scott Watson R, Pyle LL, Maddux AB.","Pediatr Pulmonol. 2022 Jul;57(7):1651-1659. doi: 10.1002/ppul.25934. Epub 2022 Apr 26.","Vo M","Pediatr Pulmonol","2022","2022/04/19","PMC9233134","NIHMS1799621","10.1002/ppul.25934"
"35441664","A new prediction model for ventricular arrhythmias in arrhythmogenic right ventricular cardiomyopathy","Cadrin-Tourigny J, Bosman LP, Nozza A, Wang W, Tadros R, Bhonsale A, Bourfiss M, Fortier A, Lie ØH, Saguner AM, Svensson A, Andorin A, Tichnell C, Murray B, Zeppenfeld K, van den Berg MP, Asselbergs FW, Wilde AAM, Krahn AD, Talajic M, Rivard L, Chelko S, Zimmerman SL, Kamel IR, Crosson JE, Judge DP, Yap SC, van der Heijden JF, Tandri H, Jongbloed JDH, Guertin MC, van Tintelen JP, Platonov PG, Duru F, Haugaa KH, Khairy P, Hauer RNW, Calkins H, Te Riele ASJM, James CA.","Eur Heart J. 2022 Aug 21;43(32):e1-e9. doi: 10.1093/eurheartj/ehac180.","Cadrin-Tourigny J","Eur Heart J","2022","2022/04/20","PMC9392651","","10.1093/eurheartj/ehac180"
"35918188","Predicting postpartum haemorrhage: A systematic review of prognostic models","Carr BL, Jahangirifar M, Nicholson AE, Li W, Mol BW, Licqurish S.","Aust N Z J Obstet Gynaecol. 2022 Dec;62(6):813-825. doi: 10.1111/ajo.13599. Epub 2022 Aug 2.","Carr BL","Aust N Z J Obstet Gynaecol","2022","2022/08/02","PMC10087871","","10.1111/ajo.13599"
"34862535","Is My Clinical Prediction Model Clinically Useful? A Primer on Decision Curve Analysis","Mijderwijk HJ, Nieboer D.","Acta Neurochir Suppl. 2022;134:115-118. doi: 10.1007/978-3-030-85292-4_15.","Mijderwijk HJ","Acta Neurochir Suppl","2022","2021/12/04","","","10.1007/978-3-030-85292-4_15"
"34746776","Whole-Body Reactive Agility Metrics to Identify Football Players With a Core and Lower Extremity Injury Risk","Bruce SL, Wilkerson GB.","Front Sports Act Living. 2021 Oct 20;3:733567. doi: 10.3389/fspor.2021.733567. eCollection 2021.","Bruce SL","Front Sports Act Living","2021","2021/11/08","PMC8564038","","10.3389/fspor.2021.733567"
"37883164","Temporal Generalizability of Machine Learning Models for Predicting Postoperative Delirium Using Electronic Health Record Data: Model Development and Validation Study","Matsumoto K, Nohara Y, Sakaguchi M, Takayama Y, Fukushige S, Soejima H, Nakashima N, Kamouchi M.","JMIR Perioper Med. 2023 Oct 26;6:e50895. doi: 10.2196/50895.","Matsumoto K","JMIR Perioper Med","2023","2023/10/26","PMC10636625","","10.2196/50895"
"37821690","Prediction models should contain predictors known at the moment of intended use","Collins GS, Dhiman P.","Aging Clin Exp Res. 2023 Dec;35(12):3243-3244. doi: 10.1007/s40520-023-02560-2. Epub 2023 Oct 11.","Collins GS","Aging Clin Exp Res","2023","2023/10/11","","","10.1007/s40520-023-02560-2"
"31015133","Longitudinal radiomics of cone-beam CT images from non-small cell lung cancer patients: Evaluation of the added prognostic value for overall survival and locoregional recurrence","van Timmeren JE, van Elmpt W, Leijenaar RTH, Reymen B, Monshouwer R, Bussink J, Paelinck L, Bogaert E, De Wagter C, Elhaseen E, Lievens Y, Hansen O, Brink C, Lambin P.","Radiother Oncol. 2019 Jul;136:78-85. doi: 10.1016/j.radonc.2019.03.032. Epub 2019 Apr 11.","van Timmeren JE","Radiother Oncol","2019","2019/04/25","PMC6598851","","10.1016/j.radonc.2019.03.032"
"37639271","Prediction Model for Early-Stage Pancreatic Cancer Using Routinely Measured Blood Biomarkers","Boyd LNC, Ali M, Comandatore A, Garajova I, Kam L, Puik JR, Fraga Rodrigues SM, Meijer LL, Le Large TYS, Besselink MG, Morelli L, Frampton A, van Laarhoven HWM, Giovannetti E, Kazemier G.","JAMA Netw Open. 2023 Aug 1;6(8):e2331197. doi: 10.1001/jamanetworkopen.2023.31197.","Boyd LNC","JAMA Netw Open","2023","2023/08/28","PMC10463099","","10.1001/jamanetworkopen.2023.31197"
"34649526","Predicting unplanned hospital visits in older home care recipients: a cross-country external validation study","Klunder JH, Bordonis V, Heymans MW, van der Roest HG, Declercq A, Smit JH, Garms-Homolova V, Jónsson PV, Finne-Soveri H, Onder G, Joling KJ, Maarsingh OR, van Hout HPJ.","BMC Geriatr. 2021 Oct 14;21(1):551. doi: 10.1186/s12877-021-02521-2.","Klunder JH","BMC Geriatr","2021","2021/10/15","PMC8515741","","10.1186/s12877-021-02521-2"
"37704994","Application of a practice-based approach in variable selection for a prediction model development study of hospital-induced delirium","Snigurska UA, Ser SE, Solberg LM, Prosperi M, Magoc T, Chen Z, Bian J, Bjarnadottir RI, Lucero RJ.","BMC Med Inform Decis Mak. 2023 Sep 13;23(1):181. doi: 10.1186/s12911-023-02278-1.","Snigurska UA","BMC Med Inform Decis Mak","2023","2023/09/13","PMC10500854","","10.1186/s12911-023-02278-1"
"31265833","Publishing a Clinical Research Manuscript: Guidance for Early-Career Researchers With a Focus on Pulmonary and Critical Care Medicine","Viglianti EM, Admon AJ, Carlton EF, Hensley MK, Prescott HC, Iwashyna TJ, McSparron JI.","Chest. 2019 Dec;156(6):1054-1061. doi: 10.1016/j.chest.2019.06.014. Epub 2019 Jun 29.","Viglianti EM","Chest","2019","2019/07/03","PMC6904852","","10.1016/j.chest.2019.06.014"
"37710218","Erector spinae muscle-based nomogram for predicting in-hospital mortality among older patients with severe community-acquired pneumonia","Shang N, Li Q, Liu H, Li J, Guo S.","BMC Pulm Med. 2023 Sep 14;23(1):346. doi: 10.1186/s12890-023-02640-z.","Shang N","BMC Pulm Med","2023","2023/09/14","PMC10500910","","10.1186/s12890-023-02640-z"
"35891394","Weekly Nowcasting of New COVID-19 Cases Using Past Viral Load Measurements","Khalil A, Al Handawi K, Mohsen Z, Abdel Nour A, Feghali R, Chamseddine I, Kokkolaras M.","Viruses. 2022 Jun 28;14(7):1414. doi: 10.3390/v14071414.","Khalil A","Viruses","2022","2022/07/27","PMC9317659","","10.3390/v14071414"
"37770952","Predicting mammographic density with linear ultrasound transducers","Behrens A, Fasching PA, Schwenke E, Gass P, Häberle L, Heindl F, Heusinger K, Lotz L, Lubrich H, Preuß C, Schneider MO, Schulz-Wendtland R, Stumpfe FM, Uder M, Wunderle M, Zahn AL, Hack CC, Beckmann MW, Emons J.","Eur J Med Res. 2023 Sep 28;28(1):384. doi: 10.1186/s40001-023-01327-9.","Behrens A","Eur J Med Res","2023","2023/09/28","PMC10537934","","10.1186/s40001-023-01327-9"
"37718627","Initial von Willebrand factor antigen values in adolescent females predict future values","Cohen CT, Zobeck M, Powers JM.","Haemophilia. 2023 Nov;29(6):1547-1555. doi: 10.1111/hae.14865. Epub 2023 Sep 18.","Cohen CT","Haemophilia","2023","2023/09/18","PMC10693906","NIHMS1934968","10.1111/hae.14865"
"36013053","Predictive Modeling for Suicide-Related Outcomes and Risk Factors among Patients with Pain Conditions: A Systematic Review","Huang S, Lewis MO, Bao Y, Adekkanattu P, Adkins LE, Banerjee S, Bian J, Gellad WF, Goodin AJ, Luo Y, Fairless JA, Walunas TL, Wilson DL, Wu Y, Yin P, Oslin DW, Pathak J, Lo-Ciganic WH.","J Clin Med. 2022 Aug 17;11(16):4813. doi: 10.3390/jcm11164813.","Huang S","J Clin Med","2022","2022/08/26","PMC9409905","","10.3390/jcm11164813"
"34838076","Development of a prognostic model for 1-year survival after fragile hip fracture in Chinese","Fu H, Liang B, Qin W, Qiao X, Liu Q.","J Orthop Surg Res. 2021 Nov 27;16(1):695. doi: 10.1186/s13018-021-02774-y.","Fu H","J Orthop Surg Res","2021","2021/11/28","PMC8626932","","10.1186/s13018-021-02774-y"
"31941530","Validation of prediction models of severe disease course and non-achievement of remission in juvenile idiopathic arthritis part 2: results of the Nordic model in the Canadian cohort","Henrey A, Rypdal V, Rypdal M, Loughin T, Nordal E, Guzman J; ReACCh-Out and NoSPeR Investigators.","Arthritis Res Ther. 2020 Jan 15;22(1):10. doi: 10.1186/s13075-019-2091-8.","Henrey A","Arthritis Res Ther","2020","2020/01/17","PMC6964007","","10.1186/s13075-019-2091-8"
"32488865","External validation of radiomics-based predictive models in low-dose CT screening for early lung cancer diagnosis","Garau N, Paganelli C, Summers P, Choi W, Alam S, Lu W, Fanciullo C, Bellomi M, Baroni G, Rampinelli C.","Med Phys. 2020 Sep;47(9):4125-4136. doi: 10.1002/mp.14308. Epub 2020 Jun 23.","Garau N","Med Phys","2020","2020/06/04","PMC7708421","NIHMS1615197","10.1002/mp.14308"
"34921517","Prognosis of high-risk human papillomavirus-related cervical lesions: A hidden Markov model analysis of a single-center cohort in Japan","Ikesu R, Taguchi A, Hara K, Kawana K, Tsuruga T, Tomio J, Osuga Y.","Cancer Med. 2022 Feb;11(3):664-675. doi: 10.1002/cam4.4470. Epub 2021 Dec 17.","Ikesu R","Cancer Med","2022","2021/12/18","PMC8817087","","10.1002/cam4.4470"
"29958772","Parotid gland fat related Magnetic Resonance image biomarkers improve prediction of late radiation-induced xerostomia","van Dijk LV, Thor M, Steenbakkers RJHM, Apte A, Zhai TT, Borra R, Noordzij W, Estilo C, Lee N, Langendijk JA, Deasy JO, Sijtsema NM.","Radiother Oncol. 2018 Sep;128(3):459-466. doi: 10.1016/j.radonc.2018.06.012. Epub 2018 Jun 26.","van Dijk LV","Radiother Oncol","2018","2018/07/01","PMC6625348","NIHMS1038208","10.1016/j.radonc.2018.06.012"
"32425813","A Novel Predictive Method Incorporating Parameters of Main Pulmonary Artery Bifurcation for Short-Term Prognosis in Non-high-risk Acute Pulmonary Embolism Patients","Jia D, Li XL, Hou G, Zhou XM.","Front Physiol. 2020 Apr 30;11:420. doi: 10.3389/fphys.2020.00420. eCollection 2020.","Jia D","Front Physiol","2020","2020/05/20","PMC7203501","","10.3389/fphys.2020.00420"
"32301044","Predictors of Hyperkalemia and Hypokalemia in Individuals with Diabetes: a Classification and Regression Tree Analysis","Schroeder EB, Adams JL, Chonchol M, Nichols GA, O'Connor PJ, Powers JD, Schmittdiel JA, Shetterly SM, Steiner JF.","J Gen Intern Med. 2020 Aug;35(8):2321-2328. doi: 10.1007/s11606-020-05799-x. Epub 2020 Apr 16.","Schroeder EB","J Gen Intern Med","2020","2020/04/18","PMC7403274","","10.1007/s11606-020-05799-x"
"29705752","Systematic review of prediction models for delirium in the older adult inpatient","Lindroth H, Bratzke L, Purvis S, Brown R, Coburn M, Mrkobrada M, Chan MTV, Davis DHJ, Pandharipande P, Carlsson CM, Sanders RD.","BMJ Open. 2018 Apr 28;8(4):e019223. doi: 10.1136/bmjopen-2017-019223.","Lindroth H","BMJ Open","2018","2018/04/30","PMC5931306","","10.1136/bmjopen-2017-019223"
"34208640","Predictive Value of Comorbid Conditions for COVID-19 Mortality","Marincu I, Bratosin F, Vidican I, Bostanaru AC, Frent S, Cerbu B, Turaiche M, Tirnea L, Timircan M.","J Clin Med. 2021 Jun 16;10(12):2652. doi: 10.3390/jcm10122652.","Marincu I","J Clin Med","2021","2021/07/02","PMC8233968","","10.3390/jcm10122652"
"34452608","Predicting change in symptoms and function in patients with persistent shoulder pain: a prognostic model development study","Rønnow MM, Stæhr TAB, Christiansen DH.","BMC Musculoskelet Disord. 2021 Aug 27;22(1):732. doi: 10.1186/s12891-021-04612-y.","Rønnow MM","BMC Musculoskelet Disord","2021","2021/08/28","PMC8401246","","10.1186/s12891-021-04612-y"
